{
  "schemaVersion": 1,
  "generatedAtUtc": "2026-07-03T03:00:34.7628686Z",
  "testProjects": [
    {
      "name": "RoslynKit.AtlasPromptCacheProbe",
      "path": "tests/RoslynKit.AtlasPromptCacheProbe/RoslynKit.AtlasPromptCacheProbe.csproj",
      "category": "test-support"
    },
    {
      "name": "RoslynKit.Tests",
      "path": "tests/RoslynKit.Tests/RoslynKit.Tests.csproj",
      "category": "test"
    },
    {
      "name": "RoslynKit.WorkspaceGraphDump",
      "path": "tests/RoslynKit.WorkspaceGraphDump/RoslynKit.WorkspaceGraphDump.csproj",
      "category": "test-support"
    }
  ],
  "testFiles": [
    {
      "path": "tests/RoslynKit.Tests/AtlasPromptCacheProbeTests.cs",
      "category": "test"
    },
    {
      "path": "tests/RoslynKit.Tests/CliOutputTests.cs",
      "category": "cli-output"
    },
    {
      "path": "tests/RoslynKit.Tests/CliParserTests.cs",
      "category": "parser"
    },
    {
      "path": "tests/RoslynKit.Tests/CommandExecutionTests.cs",
      "category": "execution"
    },
    {
      "path": "tests/RoslynKit.Tests/CompactFormatTests.cs",
      "category": "test"
    },
    {
      "path": "tests/RoslynKit.Tests/EnvelopeTests.cs",
      "category": "test"
    },
    {
      "path": "tests/RoslynKit.Tests/MarkdownFormatTests.cs",
      "category": "markdown-output"
    },
    {
      "path": "tests/RoslynKit.Tests/SymbolsCommandTests.cs",
      "category": "symbols"
    },
    {
      "path": "tests/RoslynKit.Tests/TestPaths.cs",
      "category": "support"
    },
    {
      "path": "tests/RoslynKit.Tests/TextFormatTests.cs",
      "category": "test"
    },
    {
      "path": "tests/RoslynKit.Tests/XunitOutputProbeTests.cs",
      "category": "test"
    }
  ],
  "supportFiles": [
    {
      "path": "tests/FixtureWorkspace/App/.editorconfig",
      "category": "fixture"
    },
    {
      "path": "tests/FixtureWorkspace/App/App.csproj",
      "category": "fixture"
    },
    {
      "path": "tests/FixtureWorkspace/App/notes.txt",
      "category": "fixture"
    },
    {
      "path": "tests/FixtureWorkspace/App/Source.cs",
      "category": "fixture"
    },
    {
      "path": "tests/RoslynKit.WorkspaceGraphDump/Program.cs",
      "category": "workspace-utility"
    },
    {
      "path": "tests/RoslynKit.WorkspaceGraphDump/RoslynKit.WorkspaceGraphDump.csproj",
      "category": "workspace-utility"
    }
  ]
}
